{
  "schema": "uiai.focusa_ui_eval_scenario.v1",
  "scenario_id": "spec135-c2-cited-context-retrieval",
  "feature_scope": {"project_root":"/example/focusa","continuity_id":"focusa-cont-c2-generated-ui","attachment_id":"attachment:c2-context"},
  "route_or_target": "packages/a2ui-renderer/proof/context-retrieve.html",
  "preconditions": [
    "focusa.context.retrieve is a generated Operation Registry binding",
    "Canonical Markdown sources can be seeded idempotently",
    "The proof server proxies the generated TypeScript client to a real Focusa daemon"
  ],
  "steps": [
    {"step_id":"open","action":"open","target":"Cited Context retrieval proof","expected":"Generated exact-scope search action renders","evidence_kind":"dom"},
    {"step_id":"retrieve","action":"click","target":"Find Cited Context","expected":"Canonical sources are indexed and retrieved through generated client","evidence_kind":"action"},
    {"step_id":"citations","action":"read","target":"Retrieval results","expected":"Every hit preserves source/revision/chunk/line citation","evidence_kind":"dom"},
    {"step_id":"contradiction","action":"read","target":"Contradiction review","expected":"Opposite-polarity source assertions surface as candidate, not canonical truth","evidence_kind":"dom"},
    {"step_id":"mobile","action":"resize","target":"390x844 viewport","expected":"No horizontal overflow and nested primary action remains focusable","evidence_kind":"screenshot"},
    {"step_id":"diagnostics","action":"diagnostics","target":"UIAI browser session","expected":"No console exception or failed request","evidence_kind":"diagnostics"},
    {"step_id":"close","action":"close","target":"UIAI browser session","expected":"Session resources are released","evidence_kind":"diagnostics"}
  ],
  "required_capabilities": ["context","sqlite-fts5","sqlite-vec","fastembed-rs","a2ui-web_core-0.9.1","a2ui-lit-0.9.1","focusa-svelte-elements-0.9.120-dev"],
  "required_scopes": ["project_root","continuity_id","attachment_id"],
  "expected_visible_states": ["ready","processing","completed","degraded","review","retry"],
  "expected_actions": ["focusa.context.retrieve allowed and exact-scoped"],
  "expected_evidence": ["source-preserving citations","contradiction candidate","desktop screenshot","mobile screenshot","bounded diagnostics"],
  "expected_receipts": ["deterministic retrieval Receipt ref"]
}
