{"schema":"uiai.focusa_ui_eval_scenario.v1","scenario_id":"spec135-ri3-durable-interview-resume","feature_scope":{"project_root":"/example/focusa","continuity_id":"focusa-cont-ri3-generated-ui","attachment_id":"attachment:ri3-interview"},"route_or_target":"packages/a2ui-renderer/proof/interview-resume.html","preconditions":["Canonical Context and approved Role exist","Generated Interview list/mutate bindings target a real daemon"],"steps":[{"step_id":"open","action":"open","target":"Continue Interview proof","expected":"Generated durable Interview surface renders","evidence_kind":"dom"},{"step_id":"resume","action":"click","target":"Run Resume Proof","expected":"Branches persist, one branch remains deferred, and close/reopen preserves exact active question","evidence_kind":"action"},{"step_id":"mobile","action":"resize","target":"390x844","expected":"No horizontal overflow","evidence_kind":"screenshot"},{"step_id":"diagnostics","action":"diagnostics","target":"final window","expected":"No browser failures","evidence_kind":"diagnostics"}],"required_capabilities":["durable-interview-state","exact-close-reopen","deferred-branch-governance","a2ui-lit-generated-ui"],"required_scopes":["project_root","continuity_id","attachment_id"],"expected_visible_states":["ready","running","completed","recovery"],"expected_actions":["focusa.interview.session.mutate"],"expected_evidence":["revision","active branch","current question","deferred branch","desktop/mobile screenshots","diagnostics"],"expected_receipts":["canonical Interview mutation Receipts"]}
